### ISSUE TITLE
call home NOT initiating the connection after temporarily disconnection 

### ISSUE THREAD

**Issue by vishalwc** [CESNET/netopeer2#292]
Hi Michal 

from Netconf server and TCP call home client shows  the connection is established 
NODEC21 ~]# netstat -anp | grep 4334
tcp        0      0 51.51.51.1:43364        192.168.2.15:4334       ESTABLISHED 3870/netopeer2-serv

from the netconf client and  TCP server ( 192.168.2.15) there is no connection 
[mgmt-380 ~]# netstat -anp | grep 4334
tcp6       0      0 :::4334                 :::*                    LISTEN      896/java  

please let me know what can be issue

**Comment by michalvasko** [comment]
Hi,
I will need more information than this to actually help you. What is exactly your scenario? I mean what configuration does your netopeer2 have (`ietf-netconf-server` data)? I guess you connected using Call Home and then how did the session terminate? Please, simply provide much more details.

Regards,
Michal

**Comment by vishalwc** [comment]
Hi Michal 

Thanks for the feedback 

The call home connection is persistence type
The connection was left for whole night and in between due to network condition it got temporarily disconnected .
later the call home client, even after the connection restore ,got stuck in the ESTABLISHED state and not initiating the call home request 

TCP dump on 4334 port for that interface is not showing any  packets or communication

**Comment by michalvasko** [comment]
Hi,
well, was the NETCONF session terminated? You would know by the output of the server and/or client, so can you please paste it here?

Regards,
Michal

**Comment by vishalwc** [comment]
yes the call home server cleaned connection from his end so ssh connection was terminated form the server

**Comment by michalvasko** [comment]
Okay, so can you please paste it here? I need to know exactly what messages were printed so I know what code was executed.

Regards,
Michal

**Comment by vishalwc** [comment]
actually there are no logs that server disconnected or related to it , may be because the connection was lost temporarily it did not reach . 
however after some time connected call home client should realize that connection is  lost and retry the call home connection which is not happening.

**Comment by michalvasko** [comment]
Well, now I am confused. I first asked you whether the NETCONF session was terminated and you said that server did clean the connection but now you are saying there are no logs of that so how do you know? Anyway, I am just trying to find out if there is some other problem in *libnetconf2* other than missing keep-alive feature. But, we enable keep-alive on TCP level so that should be enough, in theory.

Still, with these problems I need to know exactly what was happening on TCP layer (SSH) and on NETCONF layer, otherwise I am unable to help.

Regards,
Michal

**Comment by vishalwc** [comment]
The call home server is listening on 4334 port and it cleaned the connection from the logs 
but netopeer2 running on the call home client does not change the status and does not have any logs in that period .

Note : The mgmt server which is call home server in our case is cleaning the connection and earlier netstat show it .

**Comment by michalvasko** [comment]
Hi,
meaning NETCONF client disconnects but NETCONF server does not. Like I said, not having implemented Call Home keep-alive (on NETCONF layer) we rely on the TCP one. That does not seem to do its job so I will investigate more. However, I am working on other things currently so I will reply later.

Regards,
Michal

**Comment by vishalwc** [comment]
Thanks Michal appreciate your support .
will be helpful if I get feedback on work around by tomorrow

**Comment by michalvasko** [comment]
Hi,
then I must disappoint you because we have state holidays tomorrow and the day after, so I should be able to take a look next week, perhaps Monday.

Regards,
Michal

**Comment by vishalwc** [comment]
Hi Michal ,
did you get a chance to work on it .
I am planning to enable socket with keep alive message.

**Comment by michalvasko** [comment]
Hi,
I did just now and it is possible the keep-alive is working because, by default, an idle connection is dropped after ~2 hours and 11 minutes. However, it was set on client-side, which is probably why the server did not detect it. I have moved it to server-side and adjusted the options so that disconnected socket should be detected after ~1 minute. Can you test it with the latest *libnetconf2*, please? I was seeing the packets using `tcpdump` but not tried whether it really works and Call Home sessions are re-established.

Regards,
Michal

**Comment by vishalwc** [comment]
Thanks Michal
looks like you change to server however 
there is common place nc_sock_connect() where the socket is created and connect call is made 
we can have all session created with keep alive .

if(setsockopt(sock, SOL_SOCKET, SO_KEEPALIVE, &optval, optlen) < 0) {
            close(sock);
            sock = -1;
            continue;
        }

while creating the socket isn't the right place ? please let me if I am missing something 

Incidentally as the version which I am using is already being part of product so NOT sure I can take latest  libnetconf2 library and keep the old netopeer2 same and it will work together .

appreciate your feedback earliest

**Comment by michalvasko** [comment]
Hi,
based on what I read it should be enough to set these options on the listening socket and they are inherited by all the accepted sockets. It worked when I tested it.

Regarding the versions, it depends what exact *netopeer2-server* version is your product using. Also, if you just cherry-pick the referenced commit, it should work.

Regards,
Michal

**Comment by vladique00** [comment]
Hey. 
I see a similar problem.
We are trying to use firewall (fw3) in OpenWrt with our plugin.
Step by step:
1. Send the firewall configuration;
 1.1. The config is applied;
 1.2. The firewall reload is called (at this time the conntrack table is cleared);
2. Send the firewall configuration again and get an error:
    "error-message": "NETCONF operation failed",
    "error-info": "Unable to read data: Optional[/(urn:dev:cpe:firewall?revision=2019-08-29)firewall],
     errors: [RpcError [message=Session closed, severity=ERROR, errorType=TRANSPORT,
     tag=operation-failed, applicationTag=null, info=null, cause=null]]"

At this time netstat shows Established connection. Reconnection does not occur.

After send sigint to netopper2-server:
^C[INF]: Client Subscription Manager successfully destroyed.
[INF]: Call Home client "dev_test_odl" session terminated, reconnecting...
[INF]: nc_sock_connect(acs.test.ce.corp.net, 36666, 5, -1)
[INF]: Trying to connect via IPv6.
[INF]: Successfully connected to acs.test.ce.corp.net:36666 over IPv6.
[WRN]: String "dev_test_odl_entrypoint" not freed from the dictionary, refcount 1
[WRN]: String "acs.test.ce.corp.net" not freed from the dictionary, refcount 2
[WRN]: String "ssh_host_rsa_key" not freed from the dictionary, refcount 1
[WRN]: String "dev_test_odl" not freed from the dictionary, refcount 1

netconf-server config:
<netconf-server xmlns="urn:ietf:params:xml:ns:yang:ietf-netconf-server">
  <call-home>
    <netconf-client>
      <name>itmh_test_odl</name>
      <ssh>
        <endpoints>
          <endpoint>
            <name>dev_test_odl_entrypoint</name>
            <address>acs.test.ce.corp.net</address>
            <port>36666</port>
          </endpoint>
        </endpoints>
        <host-keys>
          <host-key>
            <name>test_ssh_callhome_key</name>
            <public-key>ssh_host_rsa_key</public-key>
          </host-key>
        </host-keys>
      </ssh>
      <connection-type>
        <persistent/>
      </connection-type>
    </netconf-client>
  </call-home>
</netconf-server>

Netopeer2 version 0.7 - release 1 (Didn`t see commits related to this in release 2. Tell me if it makes sense to check.)

**Comment by michalvasko** [comment]
Hi,
please post the full output of `netopeer2-server -v2` until (including) the error? Thanks.

Regards,
Michal

**Comment by vladique00** [comment]
```
root@OpenWrt:/# netopeer2-server -dv2
[INF]: Connected to daemon Sysrepo Engine at socket=/var/run/sysrepod.sock
[INF]: Netopeer2 connected to sysrepod.
[INF]: Plugin "/usr/lib/libyang/extensions/metadata.so" successfully loaded.
[INF]: Plugin "/usr/lib/libyang/extensions/nacm.so" successfully loaded.
[INF]: Plugin "/usr/lib/libyang/extensions/yangdata.so" successfully loaded.
[INF]: Plugin "/usr/lib/libyang/user_types/user_inet_types.so" successfully loaded.
[INF]: Plugin "/usr/lib/libyang/user_types/user_yang_types.so" successfully loaded.
[INF]: Reading module "ietf-yang-metadata".
[INF]: Module "ietf-yang-metadata@2016-08-05" successfully parsed as implemented.
[INF]: Reading module "yang".
[INF]: Resolving "yang" unresolved schema nodes and their constraints...
[INF]: All "yang" schema nodes and constraints resolved.
[INF]: Module "yang@2017-02-20" successfully parsed as implemented.
[INF]: Reading module "ietf-inet-types".
[INF]: Resolving derived type "union" failed, it will be attempted later.
[INF]: Resolving derived type "union" failed, it will be attempted later.
[INF]: Resolving derived type "union" failed, it will be attempted later.
[INF]: Resolving derived type "union" failed, it will be attempted later.
[INF]: Resolving "ietf-inet-types" unresolved schema nodes and their constraints...
[INF]: All "ietf-inet-types" schema nodes and constraints resolved.
[INF]: Module "ietf-inet-types@2013-07-15" successfully parsed as implemented.
[INF]: Reading module "ietf-yang-types".
[INF]: Module "ietf-yang-types@2013-07-15" successfully parsed as implemented.
[INF]: Reading module "ietf-datastores".
[INF]: Module "ietf-datastores@2017-08-17" successfully parsed as implemented.
[INF]: Reading module "ietf-yang-library".
[INF]: Module "ietf-yang-library@2018-01-17" successfully parsed as implemented.
[INF]: Loading schema "notifications@2008-07-14" from sysrepo.
[INF]: Reading module "notifications".
[INF]: Module "notifications@2008-07-14" successfully parsed as implemented.
[INF]: Loading schema "nc-notifications@2008-07-14" from sysrepo.
[INF]: Reading module "nc-notifications".
[INF]: Reading module "notifications".
[INF]: Module "notifications@2008-07-14" already in context.
[INF]: Module "notifications@2008-07-14" successfully parsed as implemented.
[INF]: Module "nc-notifications@2008-07-14" successfully parsed as implemented.
[INF]: Loading schema "ietf-netconf-acm@2018-02-14" from sysrepo.
[INF]: Reading module "ietf-netconf-acm".
[INF]: Module "ietf-netconf-acm@2018-02-14" successfully parsed as implemented.
[INF]: Loading schema "ietf-netconf-notifications@2012-02-06" from sysrepo.
[INF]: Reading module "ietf-netconf-notifications".
[INF]: Reading module "ietf-netconf".
[INF]: Reading module "ietf-netconf-acm".
[INF]: Module "ietf-netconf-acm@2018-02-14" already in context.
[INF]: Module "ietf-netconf-acm@2018-02-14" successfully parsed as implemented.
[INF]: Module "ietf-netconf@2011-06-01" successfully parsed as imported.
[INF]: Resolving "ietf-netconf-notifications" unresolved schema nodes and their constraints...
[INF]: All "ietf-netconf-notifications" schema nodes and constraints resolved.
[INF]: Module "ietf-netconf-notifications@2012-02-06" successfully parsed as implemented.
[INF]: Loading schema "ietf-netconf@2011-06-01" from sysrepo.
[INF]: Module ietf-netconf@2011-06-01 already present in context.
[INF]: Module "ietf-netconf@2011-06-01" now implemented.
[INF]: Loading schema "dev-cpe-dhcp@2019-08-23" from sysrepo.
[INF]: Reading module "dev-cpe-dhcp".
[INF]: Reading module "dev-yang-types".
[INF]: Module "dev-yang-types@2019-07-15" successfully parsed as imported.
[INF]: Module "dev-cpe-dhcp@2019-08-23" successfully parsed as implemented.
[INF]: Loading schema "dev-yang-types@2019-07-15" from sysrepo.
[INF]: Module dev-yang-types@2019-07-15 already present in context.
[INF]: Loading schema "dev-cpe-wireless@2019-09-06" from sysrepo.
[INF]: Reading module "dev-cpe-wireless".
[INF]: Resolving "dev-cpe-wireless" unresolved schema nodes and their constraints...
[INF]: All "dev-cpe-wireless" schema nodes and constraints resolved.
[INF]: Module "dev-cpe-wireless@2019-09-06" successfully parsed as implemented.
[INF]: Loading schema "dev-cpe-info@2019-09-06" from sysrepo.
[INF]: Reading module "dev-cpe-info".
[INF]: Module "dev-cpe-info@2019-09-06" successfully parsed as implemented.
[INF]: Loading schema "dev-cpe-firmware@2019-09-06" from sysrepo.
[INF]: Reading module "dev-cpe-firmware".
[INF]: Module "dev-cpe-firmware@2019-09-06" successfully parsed as implemented.
[INF]: Loading schema "dev-cpe-firewall@2019-08-29" from sysrepo.
[INF]: Reading module "dev-cpe-firewall".
[INF]: Resolving "dev-cpe-firewall" unresolved schema nodes and their constraints...
[INF]: All "dev-cpe-firewall" schema nodes and constraints resolved.
[INF]: Module "dev-cpe-firewall@2019-08-29" successfully parsed as implemented.
[INF]: Loading schema "dev-cpe-debug@2019-09-06" from sysrepo.
[INF]: Reading module "dev-cpe-debug".
[INF]: Module "dev-cpe-debug@2019-09-06" successfully parsed as implemented.
[INF]: Loading schema "ietf-keystore@2016-10-31" from sysrepo.
[INF]: Reading module "ietf-keystore".
[INF]: Module "ietf-keystore@2016-10-31" successfully parsed as implemented.
[INF]: Loading schema "ietf-ssh-server@2016-11-02" from sysrepo.
[INF]: Reading module "ietf-ssh-server".
[INF]: Reading module "ietf-keystore".
[INF]: Module "ietf-keystore@2016-10-31" already in context.
[INF]: Module "ietf-keystore@2016-10-31" successfully parsed as implemented.
[INF]: Module "ietf-ssh-server@2016-11-02" successfully parsed as implemented.
[INF]: Loading schema "ietf-tls-server@2016-11-02" from sysrepo.
[INF]: Reading module "ietf-tls-server".
[INF]: Module "ietf-tls-server@2016-11-02" successfully parsed as implemented.
[INF]: Loading schema "iana-crypt-hash@2014-08-06" from sysrepo.
[INF]: Reading module "iana-crypt-hash".
[INF]: Module "iana-crypt-hash@2014-08-06" successfully parsed as implemented.
[INF]: Loading schema "ietf-x509-cert-to-name@2014-12-10" from sysrepo.
[INF]: Reading module "ietf-x509-cert-to-name".
[INF]: Module "ietf-x509-cert-to-name@2014-12-10" successfully parsed as implemented.
[INF]: Loading schema "ietf-netconf-server@2016-11-02" from sysrepo.
[INF]: Reading module "ietf-netconf-server".
[INF]: Reading module "ietf-x509-cert-to-name".
[INF]: Module "ietf-x509-cert-to-name@2014-12-10" already in context.
[INF]: Module "ietf-x509-cert-to-name@2014-12-10" successfully parsed as implemented.
[INF]: Resolving "ietf-netconf-server" unresolved schema nodes and their constraints...
[INF]: All "ietf-netconf-server" schema nodes and constraints resolved.
[INF]: Module "ietf-netconf-server@2016-11-02" successfully parsed as implemented.
[INF]: Loading schema "ietf-netconf-monitoring@2010-10-04" from sysrepo.
[INF]: Reading module "ietf-netconf-monitoring".
[INF]: Module "ietf-netconf-monitoring@2010-10-04" successfully parsed as implemented.
[INF]: Loading schema "ietf-netconf-with-defaults@2011-06-01" from sysrepo.
[INF]: Reading module "ietf-netconf-with-defaults".
[INF]: Module "ietf-netconf-with-defaults@2011-06-01" successfully parsed as implemented.
[INF]: Loading schema "ietf-system@2014-08-06" from sysrepo.
[INF]: Reading module "ietf-system".
[INF]: Reading module "iana-crypt-hash".
[INF]: Module "iana-crypt-hash@2014-08-06" already in context.
[INF]: Module "iana-crypt-hash@2014-08-06" successfully parsed as implemented.
[INF]: Resolving "ietf-system" unresolved schema nodes and their constraints...
[INF]: All "ietf-system" schema nodes and constraints resolved.
[INF]: Module "ietf-system@2014-08-06" successfully parsed as implemented.
[INF]: Loading schema "ietf-datastores@2017-08-17" from sysrepo.
[INF]: Module ietf-datastores@2017-08-17 already present in context.
[INF]: Module "ietf-datastores@2017-08-17" now implemented.
[INF]: Loading schema "ietf-yang-library@2018-01-17" from sysrepo.
[INF]: Module ietf-yang-library@2018-01-17 already present in context.
[INF]: Path "/ietf-netconf-server:netconf-server/call-home/netconf-client[name='dev_test_odl']/name" created.
[INF]: Path "/ietf-netconf-server:netconf-server/call-home/netconf-client[name='dev_test_odl']/ssh" created.
[INF]: Path "/ietf-netconf-server:netconf-server/call-home/netconf-client[name='dev_test_odl']/ssh/endpoints" created.
[INF]: Path "/ietf-netconf-server:netconf-server/call-home/netconf-client[name='dev_test_odl']/ssh/endpoints/endpoint[name='dev_test_odl_entrypoint']/name" created.
[INF]: Path "/ietf-netconf-server:netconf-server/call-home/netconf-client[name='dev_test_odl']/ssh/endpoints/endpoint[name='dev_test_odl_entrypoint']/address" created.
[INF]: Path "/ietf-netconf-server:netconf-server/call-home/netconf-client[name='dev_test_odl']/ssh/endpoints/endpoint[name='dev_test_odl_entrypoint']/port" created.
[INF]: Path "/ietf-netconf-server:netconf-server/call-home/netconf-client[name='dev_test_odl']/ssh/host-keys" created.
[INF]: Path "/ietf-netconf-server:netconf-server/call-home/netconf-client[name='dev_test_odl']/ssh/host-keys/host-key[name='test_ssh_callhome_key']/name" created.
[INF]: Path "/ietf-netconf-server:netconf-server/call-home/netconf-client[name='dev_test_odl']/ssh/host-keys/host-key[name='test_ssh_callhome_key']/public-key" created.
[INF]: Path "/ietf-netconf-server:netconf-server/call-home/netconf-client[name='dev_test_odl']/connection-type" created.
[INF]: Path "/ietf-netconf-server:netconf-server/call-home/netconf-client[name='dev_test_odl']/connection-type/persistent" created.
[INF]: Path "/ietf-netconf-server:netconf-server/call-home/netconf-client[name='dev_test_odl']/connection-type/persistent/idle-timeout" created.
[INF]: Path "/ietf-netconf-server:netconf-server/call-home/netconf-client[name='dev_test_odl']/connection-type/persistent/keep-alives" created.
[INF]: Path "/ietf-netconf-server:netconf-server/call-home/netconf-client[name='dev_test_odl']/connection-type/persistent/keep-alives/max-wait" created.
[INF]: Path "/ietf-netconf-server:netconf-server/call-home/netconf-client[name='dev_test_odl']/connection-type/persistent/keep-alives/max-attempts" created.
[INF]: Path "/ietf-netconf-server:netconf-server/call-home/netconf-client[name='dev_test_odl']/reconnect-strategy" created.
[INF]: Path "/ietf-netconf-server:netconf-server/call-home/netconf-client[name='dev_test_odl']/reconnect-strategy/start-with" created.
[INF]: Path "/ietf-netconf-server:netconf-server/call-home/netconf-client[name='dev_test_odl']/reconnect-strategy/max-attempts" created.
[INF]: Call Home client "dev_test_odl" connecting...
[INF]: nc_sock_connect(acs.test.ce.corp.net, 36666, 5, -1)
[INF]: Trying to connect via IPv6.
[INF]: Successfully connected to acs.test.ce.corp.net:36666 over IPv6.
[INF]: Received an SSH message "request-service" of subtype "ssh-userauth".
[INF]: Received an SSH message "request-auth" of subtype "none".
[INF]: Received an SSH message "request-auth" of subtype "interactive".
[INF]: Received an SSH message "request-auth" of subtype "interactive".
[INF]: Received an SSH message "request-auth" of subtype "interactive".
[INF]: Received an SSH message "request-auth" of subtype "interactive".
[INF]: Received an SSH message "request-auth" of subtype "password".
[INF]: User "root" authenticated.
[INF]: Received an SSH message "request-channel-open" of subtype "session".
[INF]: Received an SSH message "request-channel" of subtype "subsystem".
[INF]: Call Home client "dev_test_odl" session 1 established.
[ERR]: Error by processing of the request.
[ERR]: np2srv_sr_event_notif_send failed (sysrepo: Validation of the changes failed).
[INF]: Resolving unresolved data nodes and their constraints...
[INF]: All data nodes and constraints resolved.
[INF]: Resolving unresolved data nodes and their constraints...
[INF]: All data nodes and constraints resolved.
[INF]: Session 1: thread 0 event new RPC.

**1-st sending firewall config**

[INF]: Resolving unresolved data nodes and their constraints...
[INF]: All data nodes and constraints resolved.
[INF]: Session 1: thread 4 event new RPC.
[INF]: Resolving unresolved data nodes and their constraints...
[INF]: All data nodes and constraints resolved.
[INF]: Session 1: thread 1 event new RPC.
[INF]: Resolving unresolved data nodes and their constraints...
[INF]: All data nodes and constraints resolved.
[INF]: Resolving unresolved data nodes and their constraints...
[INF]: All data nodes and constraints resolved.
[INF]: Session 1: thread 3 event new RPC.
[INF]: Resolving unresolved data nodes and their constraints...
[INF]: All data nodes and constraints resolved.
[INF]: Session 1: thread 2 event new RPC.
[INF]: Session 1: thread 0 event new RPC.
[INF]: Resolving unresolved data nodes and their constraints...
[INF]: All data nodes and constraints resolved.
[INF]: Session 1: thread 4 event new RPC.
[INF]: Resolving unresolved data nodes and their constraints...
[INF]: All data nodes and constraints resolved.
[INF]: Session 1: thread 3 event new RPC.

**2-nd sending firewall config. No logs.**

**sigint**
^C[INF]: Client Subscription Manager successfully destroyed.
[INF]: Call Home client "dev_test_odl" session terminated, reconnecting...
[INF]: nc_sock_connect(acs.test.ce.corp.net, 36666, 5, -1)
[INF]: Trying to connect via IPv6.
[INF]: Successfully connected to acs.test.ce.corp.net:36666 over IPv6.
[WRN]: String "dev_test_odl_entrypoint" not freed from the dictionary, refcount 1
[WRN]: String "acs.test.ce.corp.net" not freed from the dictionary, refcount 2
[WRN]: String "ssh_host_rsa_key" not freed from the dictionary, refcount 1
[WRN]: String "dev_test_odl" not freed from the dictionary, refcount 1
```

**Comment by michalvasko** [comment]
Hi,
okay, that was not too helpful but it seems the problem is on TCP layer, the server did not detect session termination. But firstly, what versions (*sysrepo*, *libnetconf2*, *netopeer2*) are you using?

Can you please examine the TCP connection before the client is connected and then after it disconnects? I am interested in the keep-alive packets. You can use `tcpdump -i <interface-name>`.

Regards,
Michal

**Comment by vladique00** [comment]
Netopeer2 version 0.7 - release 1
libnetconf2 version 0.12 - release 1
sysrepo version 0.7.7

Does it make sense to check on the latest versions?

**Comment by vladique00** [comment]
I didn`t see keepalive packets in the dump.

**Comment by vladique00** [comment]
Its end of 1-st config sending:
![Снимок экрана от 2019-09-27 15-50-50](https://user-images.githubusercontent.com/19613864/65764345-ddfbcf00-e13e-11e9-973f-ead3c7abc4d7.png)

Its start of 2-nd config sending:
![Снимок экрана от 2019-09-27 15-51-00](https://user-images.githubusercontent.com/19613864/65764422-097eb980-e13f-11e9-9f66-1e6a91d02377.png)

Who send RST? Netopeer? Not system?

**Comment by vladique00** [comment]
If i accept all input traffic(not only established, related), this works fine.

**Comment by michalvasko** [comment]
Hi,
I would focus on finding out why TCP keep-alive does not work for you, this is my `tcpdump` output
```
13:21:53.903784 IP6 localhost.47474 > localhost.netconf-ch-ssh: Flags [.], ack 1, win 512, options [nop,nop,TS val 3067312529 ecr 3067307409], length 0
13:21:53.903797 IP6 localhost.netconf-ch-ssh > localhost.47474: Flags [.], ack 1, win 512, options [nop,nop,TS val 3067312529 ecr 3067307409], length 0
13:21:53.903835 IP6 localhost.netconf-ch-ssh > localhost.47474: Flags [.], ack 1, win 512, options [nop,nop,TS val 3067312529 ecr 3067307409], length 0
13:21:53.903850 IP6 localhost.47474 > localhost.netconf-ch-ssh: Flags [.], ack 1, win 512, options [nop,nop,TS val 3067312529 ecr 3067307409], length 0
13:21:59.023781 IP6 localhost.netconf-ch-ssh > localhost.47474: Flags [.], ack 1, win 512, options [nop,nop,TS val 3067317649 ecr 3067312529], length 0
13:21:59.023796 IP6 localhost.47474 > localhost.netconf-ch-ssh: Flags [.], ack 1, win 512, options [nop,nop,TS val 3067317649 ecr 3067312529], length 0
13:21:59.023835 IP6 localhost.47474 > localhost.netconf-ch-ssh: Flags [.], ack 1, win 512, options [nop,nop,TS val 3067317649 ecr 3067312529], length 0
13:21:59.023850 IP6 localhost.netconf-ch-ssh > localhost.47474: Flags [.], ack 1, win 512, options [nop,nop,TS val 3067317649 ecr 3067312529], length 0
```
Every 5 seconds the same. You can try updating *libnetconf2* but I do not think that is the problem. I am not even sure I can help more, keep-alive should be enabled [here](https://github.com/CESNET/libnetconf2/blob/master/src/session.c#L120), I do not know why it is not. But you can check that your platform defines those macros.

Also, I believe if you close the NETCONF session normally in your firewall, *netopeer2* will try to recreate the connection immediately.

Regards,
Michal
