### ISSUE TITLE
CALLhome mode :  Callback event "rpc" with ID 1 processing timed out.

### ISSUE THREAD

**Issue by qjwu888** [CESNET/Netopeer2#568]
Hi michalvasko:

Netopeer2-1.1.7 
sysrepo-1.4.2

I use netopeer-cli to set OK .
But callhome mode ,use ODL Controller setting no ok ,show the following error info.
[ERR]: SR: Module "ietf-interfaces" is locked by session 50 (NC SID 1).
[ERR]: SR: Callback event "rpc" with ID 1 processing timed out.
[WRN]: SR: Event "rpc" with ID 1 priority 0 failed (Timeout expired).
[ERR]: SR: Unable to finish processing event "rpc" with ID 1 priority 0 (timeout probably).
[ERR]: NP: Failed to send an RPC (User callback failed).

Hope to  get your help ,thanks!
============The detail info as following:==================
[INF]: LN: Call Home client "default-client" connecting...
[INF]: LN: Trying to connect via IPv4 to 192.168.10.123:6666.
[INF]: LN: Successfully connected to 192.168.10.123:6666 over IPv4.
[INF]: SR: Session 41 (user "root") created.
[INF]: LN: Received an SSH message "request-service" of subtype "ssh-userauth".
[INF]: LN: Received an SSH message "request-auth" of subtype "none".
[INF]: LN: Received an SSH message "request-auth" of subtype "interactive".
[INF]: LN: Received an SSH message "request-auth" of subtype "interactive".
[INF]: LN: Received an SSH message "request-auth" of subtype "interactive".
[INF]: LN: Received an SSH message "request-auth" of subtype "interactive".
[INF]: LN: Received an SSH message "request-auth" of subtype "password".
[INF]: LN: User "root" authenticated.
[INF]: LN: Received an SSH message "request-channel-open" of subtype "session".
[INF]: LN: Received an SSH message "request-channel" of subtype "subsystem".
[INF]: LN: Call Home client "default-client" session 1 established.
[INF]: SR: Session 42 (user "root") created.
[INF]: SR: There are no subscribers for "ietf-netconf-notifications" notifications.
[INF]: NP: Generated new event (netconf-session-start).
[INF]: LY: Resolving unresolved data nodes and their constraints...
[INF]: LY: All data nodes and constraints resolved.
[INF]: SR: Session 43 (user "root") created.
[INF]: LY: Resolving unresolved data nodes and their constraints...
[INF]: LY: All data nodes and constraints resolved.
[INF]: SR: Published event "rpc" with ID 1 priority 0 for 1 subscribers.
[INF]: SR: Processing "/ietf-netconf:get" "rpc" event with ID 1 priority 0 (remaining 1 subscribers).
[INF]: SR: Published event "operational" with ID 1.
[INF]: SR: Processing "operational" "ietf-netconf-monitoring" event with ID 1.
[INF]: SR: Finished processing "operational" event with ID 1.
[INF]: SR: Event "operational" with ID 1 succeeded.
[INF]: SR: Finished processing "rpc" event with ID 1 priority 0 (remaining 0 subscribers).
[INF]: SR: Event "rpc" with ID 1 priority 0 succeeded.
[INF]: LY: Resolving unresolved data nodes and their constraints...
[INF]: LY: All data nodes and constraints resolved.
[INF]: NP: Session 1: thread 0 event new RPC.
[INF]: LY: Resolving unresolved data nodes and their constraints...
[INF]: LY: All data nodes and constraints resolved.
[INF]: SR: Session 44 (user "root") created.
[INF]: LY: Resolving unresolved data nodes and their constraints...
[INF]: LY: All data nodes and constraints resolved.
[INF]: SR: Published event "rpc" with ID 2 priority 0 for 1 subscribers.
[INF]: SR: Processing "/ietf-netconf:get" "rpc" event with ID 2 priority 0 (remaining 1 subscribers).
[INF]: SR: Published event "operational" with ID 1.
[INF]: SR: Processing "operational" "nc-notifications" event with ID 1.
[INF]: LY: Resolving unresolved data nodes and their constraints...
[INF]: LY: All data nodes and constraints resolved.
[INF]: SR: Finished processing "operational" event with ID 1.
[INF]: SR: Event "operational" with ID 1 succeeded.
[INF]: SR: Finished processing "rpc" event with ID 2 priority 0 (remaining 0 subscribers).
[INF]: SR: Event "rpc" with ID 2 priority 0 succeeded.
[INF]: LY: Resolving unresolved data nodes and their constraints...
[INF]: LY: All data nodes and constraints resolved.
[INF]: NP: Session 1: thread 0 event new RPC.
[INF]: LY: Resolving unresolved data nodes and their constraints...
[INF]: LY: All data nodes and constraints resolved.
[INF]: SR: Session 45 (user "root") created.
[INF]: LY: Resolving unresolved data nodes and their constraints...
[INF]: LY: All data nodes and constraints resolved.
[INF]: SR: Published event "rpc" with ID 1 priority 0 for 1 subscribers.
[INF]: SR: Processing "/notifications:create-subscription" "rpc" event with ID 1 priority 0 (remaining 1 subscribers).
[INF]: SR: Finished processing "rpc" event with ID 1 priority 0 (remaining 0 subscribers).
[INF]: SR: Event "rpc" with ID 1 priority 0 succeeded.
[INF]: NP: Session 1: thread 0 event new RPC.
[INF]: LY: Resolving unresolved data nodes and their constraints...
[INF]: LY: All data nodes and constraints resolved.
[INF]: SR: Session 46 (user "root") created.
[INF]: LY: Resolving unresolved data nodes and their constraints...
[INF]: LY: All data nodes and constraints resolved.
[INF]: SR: Published event "rpc" with ID 3 priority 0 for 1 subscribers.
[INF]: SR: Processing "/ietf-netconf:get" "rpc" event with ID 3 priority 0 (remaining 1 subscribers).
[INF]: SR: Published event "operational" with ID 1.
[INF]: Processing "operational" "gwtt-device" event with ID 1.
[INF]: Finished processing "operational" event with ID 1.
[INF]: SR: Event "operational" with ID 1 succeeded.
[INF]: SR: Finished processing "rpc" event with ID 3 priority 0 (remaining 0 subscribers).
[INF]: SR: Event "rpc" with ID 3 priority 0 succeeded.
[INF]: LY: Resolving unresolved data nodes and their constraints...
[INF]: LY: All data nodes and constraints resolved.
[INF]: NP: Session 1: thread 0 event new RPC.
[INF]: LY: Resolving unresolved data nodes and their constraints...
[INF]: LY: All data nodes and constraints resolved.
[INF]: SR: Session 47 (user "root") created.
[INF]: LY: Resolving unresolved data nodes and their constraints...
[INF]: LY: All data nodes and constraints resolved.
[INF]: SR: Published event "rpc" with ID 1 priority 0 for 1 subscribers.
[INF]: SR: Processing "/ietf-netconf:get-config" "rpc" event with ID 1 priority 0 (remaining 1 subscribers).
[INF]: SR: Finished processing "rpc" event with ID 1 priority 0 (remaining 0 subscribers).
[INF]: SR: Event "rpc" with ID 1 priority 0 succeeded.
[INF]: LY: Resolving unresolved data nodes and their constraints...
[INF]: LY: All data nodes and constraints resolved.
[INF]: NP: Session 1: thread 3 event new RPC.
[INF]: LY: Resolving unresolved data nodes and their constraints...
[INF]: LY: All data nodes and constraints resolved.
[INF]: SR: Session 48 (user "root") created.
[INF]: LY: Resolving unresolved data nodes and their constraints...
[INF]: LY: All data nodes and constraints resolved.
[INF]: SR: Published event "rpc" with ID 2 priority 0 for 1 subscribers.
[INF]: SR: Processing "/ietf-netconf:get-config" "rpc" event with ID 2 priority 0 (remaining 1 subscribers).
[INF]: SR: Finished processing "rpc" event with ID 2 priority 0 (remaining 0 subscribers).
[INF]: SR: Event "rpc" with ID 2 priority 0 succeeded.
[INF]: LY: Resolving unresolved data nodes and their constraints...
[INF]: LY: All data nodes and constraints resolved.
[INF]: NP: Session 1: thread 0 event new RPC.

[INF]: LY: Resolving unresolved data nodes and their constraints...
[INF]: LY: All data nodes and constraints resolved.
[INF]: SR: Session 49 (user "root") created.
[INF]: LY: Resolving unresolved data nodes and their constraints...
[INF]: LY: All data nodes and constraints resolved.
[INF]: SR: Published event "rpc" with ID 3 priority 0 for 1 subscribers.
[INF]: SR: Processing "/ietf-netconf:get-config" "rpc" event with ID 3 priority 0 (remaining 1 subscribers).
[INF]: SR: Finished processing "rpc" event with ID 3 priority 0 (remaining 0 subscribers).
[INF]: SR: Event "rpc" with ID 3 priority 0 succeeded.
[INF]: LY: Resolving unresolved data nodes and their constraints...
[INF]: LY: All data nodes and constraints resolved.
[INF]: NP: Session 1: thread 0 event new RPC.
[INF]: LY: Resolving unresolved data nodes and their constraints...
[INF]: LY: All data nodes and constraints resolved.
[INF]: SR: Session 50 (user "root") created.
[INF]: LY: Resolving unresolved data nodes and their constraints...
[INF]: LY: All data nodes and constraints resolved.
[INF]: SR: Published event "rpc" with ID 1 priority 0 for 1 subscribers.
[INF]: SR: Processing "/ietf-netconf:lock" "rpc" event with ID 1 priority 0 (remaining 1 subscribers).
[INF]: SR: Finished processing "rpc" event with ID 1 priority 0 (remaining 0 subscribers).
[INF]: SR: Event "rpc" with ID 1 priority 0 succeeded.
[INF]: NP: Session 1: thread 2 event new RPC.
[INF]: LY: Resolving unresolved data nodes and their constraints...
[INF]: LY: All data nodes and constraints resolved.
[INF]: SR: Session 51 (user "root") created.
[INF]: LY: Resolving unresolved data nodes and their constraints...
[INF]: LY: All data nodes and constraints resolved.
[INF]: SR: Published event "rpc" with ID 1 priority 0 for 1 subscribers.
[INF]: SR: Processing "/ietf-netconf:edit-config" "rpc" event with ID 1 priority 0 (remaining 1 subscribers).
[ERR]: SR: Module "ietf-interfaces" is locked by session 50 (NC SID 1).
[ERR]: SR: Callback event "rpc" with ID 1 processing timed out.
[WRN]: SR: Event "rpc" with ID 1 priority 0 failed (Timeout expired).
[ERR]: SR: Unable to finish processing event "rpc" with ID 1 priority 0 (timeout probably).
[ERR]: NP: Failed to send an RPC (User callback failed).
[INF]: NP: Session 1: thread 2 event new RPC.
[INF]: NP: Session 1: thread 2 event reply error.
[INF]: LY: Resolving unresolved data nodes and their constraints...
[INF]: LY: All data nodes and constraints resolved.
[INF]: SR: Session 52 (user "root") created.
[INF]: LY: Resolving unresolved data nodes and their constraints...
[INF]: LY: All data nodes and constraints resolved.
[INF]: SR: Published event "rpc" with ID 1 priority 0 for 1 subscribers.
[INF]: SR: Processing "/ietf-netconf:unlock" "rpc" event with ID 1 priority 0 (remaining 1 subscribers).
[ERR]: SR: Module "yang" is locked by session 50 (NC SID 1).
[ERR]: SR: Callback event "rpc" with ID 1 processing timed out.
[WRN]: SR: Event "rpc" with ID 1 priority 0 failed (Timeout expired).
[ERR]: SR: Unable to finish processing event "rpc" with ID 1 priority 0 (timeout probably).
[ERR]: NP: Failed to send an RPC (User callback failed).
[INF]: NP: Session 1: thread 2 event new RPC.
[INF]: NP: Session 1: thread 2 event reply error.

**Comment by michalvasko** [comment]
Hi,
please update *netopeer2* (`devel-server` version 1.1.14) and try again. I have not managed to reproduce it and since there have been some internal `sysrepo` session changes, it could have been fixed. The whole problem is that `<lock>` is called on one session and `<edit-config>` is called by another. But if you still have the problem with the latest version, I would blame your NETCONF client, *netopeer2-cli* worked fine.

Regards,
Michal

**Comment by qjwu888** [comment]
Hi michalvasko:
Thanks for your reply. I will update netopeer2 (devel-server version 1.1.14) and try again.
BTY , I want to talk about my test steps again.
1. I use netopeer-cli to set ok. 
2. Then enabled callhome mode . 
3 Reboot the device . and use opendaylight controller  to set, found  no ok.
Callhome setting as following, is there any wrong?
<netconf-server xmlns="urn:ietf:params:xml:ns:yang:ietf-netconf-server">
  <listen>
    <endpoint>
      <name>default-ssh</name>
      <ssh>
        <tcp-server-parameters>
          <local-address>0.0.0.0</local-address>
          <keepalives>
            <idle-time>1</idle-time>
            <max-probes>10</max-probes>
            <probe-interval>5</probe-interval>
          </keepalives>
        </tcp-server-parameters>
        <ssh-server-parameters>
          <server-identity>
            <host-key>
              <name>default-key</name>
              <public-key>
                <keystore-reference>genkey</keystore-reference>
              </public-key>
            </host-key>
          </server-identity>
          <client-authentication>
            <supported-authentication-methods>
              <publickey/>
              <passsword/>
              <other>interactive</other>
            </supported-authentication-methods>
            <users/>
          </client-authentication>
        </ssh-server-parameters>
      </ssh>
    </endpoint>
  </listen>
  <call-home>
    <netconf-client>
      <name>default-client</name>
      <endpoints>
        <endpoint>
          <name>default-ssh</name>
          <ssh>
            <tcp-client-parameters>
              <remote-address>192.168.10.123</remote-address>
              <remote-port>6666</remote-port>
              <keepalives>
                <idle-time>1</idle-time>
                <max-probes>10</max-probes>
                <probe-interval>5</probe-interval>
              </keepalives>
            </tcp-client-parameters>
            <ssh-server-parameters>
              <server-identity>
                <host-key>
                  <name>default-key</name>
                  <public-key>
                    <keystore-reference>genkey</keystore-reference>
                  </public-key>
                </host-key>
              </server-identity>
              <client-authentication>
                <supported-authentication-methods>
                  <publickey/>
                  <passsword/>
                  <other>interactive</other>
                </supported-authentication-methods>
                <users/>
              </client-authentication>
            </ssh-server-parameters>
          </ssh>
        </endpoint>
      </endpoints>
      <connection-type>
        <persistent/>
      </connection-type>
    </netconf-client>
  </call-home>
</netconf-server>
<nacm xmlns="urn:ietf:params:xml:ns:yang:ietf-netconf-acm">
  <denied-operations>0</denied-operations>
  <denied-data-writes>0</denied-data-writes>
  <denied-notifications>0</denied-notifications>
</nacm>

**Comment by qjwu888** [comment]
<netconf-server xmlns="urn:ietf:params:xml:ns:yang:ietf-netconf-server">
  <listen>
    <endpoint>
      <name>default-ssh</name>
      <ssh>
        <tcp-server-parameters>
          <local-address>0.0.0.0</local-address>
          <keepalives>
            <idle-time>1</idle-time>
            <max-probes>10</max-probes>
            <probe-interval>5</probe-interval>
          </keepalives>
        </tcp-server-parameters>
        <ssh-server-parameters>
          <server-identity>
            <host-key>
              <name>default-key</name>
              <public-key>
                <keystore-reference>genkey</keystore-reference>
              </public-key>
            </host-key>
          </server-identity>
          <client-authentication>
            <supported-authentication-methods>
              <publickey/>
              <passsword/>
              <other>interactive</other>
            </supported-authentication-methods>
            <users/>
          </client-authentication>
        </ssh-server-parameters>
      </ssh>
    </endpoint>
  </listen>
  <call-home>
    <netconf-client>
      <name>default-client</name>
      <endpoints>
        <endpoint>
          <name>default-ssh</name>
          <ssh>
            <tcp-client-parameters>
              <remote-address>192.168.10.123</remote-address>
              <remote-port>6666</remote-port>
              <keepalives>
                <idle-time>1</idle-time>
                <max-probes>10</max-probes>
                <probe-interval>5</probe-interval>
              </keepalives>
            </tcp-client-parameters>
            <ssh-server-parameters>
              <server-identity>
                <host-key>
                  <name>default-key</name>
                  <public-key>
                    <keystore-reference>genkey</keystore-reference>
                  </public-key>
                </host-key>
              </server-identity>
              <client-authentication>
                <supported-authentication-methods>
                  <publickey/>
                  <passsword/>
                  <other>interactive</other>
                </supported-authentication-methods>
                <users/>
              </client-authentication>
            </ssh-server-parameters>
          </ssh>
        </endpoint>
      </endpoints>
      <connection-type>
        <persistent/>
      </connection-type>
    </netconf-client>
  </call-home>
</netconf-server>
<nacm xmlns="urn:ietf:params:xml:ns:yang:ietf-netconf-acm">
  <denied-operations>0</denied-operations>
  <denied-data-writes>0</denied-data-writes>
  <denied-notifications>0</denied-notifications>
</nacm>

**Comment by qjwu888** [comment]
<netconf-server xmlns="urn:ietf:params:xml:ns:yang:ietf-netconf-server">
  <listen>
    <endpoint>
      <name>default-ssh</name>
      <ssh>
        <tcp-server-parameters>
          <local-address>0.0.0.0</local-address>
          <keepalives>
            <idle-time>1</idle-time>
            <max-probes>10</max-probes>
            <probe-interval>5</probe-interval>
          </keepalives>
        </tcp-server-parameters>
        <ssh-server-parameters>
          <server-identity>
            <host-key>
              <name>default-key</name>
              <public-key>
                <keystore-reference>genkey</keystore-reference>
              </public-key>
            </host-key>
          </server-identity>
          <client-authentication>
            <supported-authentication-methods>
              <publickey/>
              <passsword/>
              <other>interactive</other>
            </supported-authentication-methods>
            <users/>
          </client-authentication>
        </ssh-server-parameters>
      </ssh>
    </endpoint>
  </listen>
  <call-home>
    <netconf-client>
      <name>default-client</name>
      <endpoints>
        <endpoint>
          <name>default-ssh</name>
          <ssh>
            <tcp-client-parameters>
              <remote-address>192.168.10.123</remote-address>
              <remote-port>6666</remote-port>
              <keepalives>
                <idle-time>1</idle-time>
                <max-probes>10</max-probes>
                <probe-interval>5</probe-interval>
              </keepalives>
            </tcp-client-parameters>
            <ssh-server-parameters>
              <server-identity>
                <host-key>
                  <name>default-key</name>
                  <public-key>
                    <keystore-reference>genkey</keystore-reference>
                  </public-key>
                </host-key>
              </server-identity>
              <client-authentication>
                <supported-authentication-methods>
                  <publickey/>
                  <passsword/>
                  <other>interactive</other>
                </supported-authentication-methods>
                <users/>
              </client-authentication>
            </ssh-server-parameters>
          </ssh>
        </endpoint>
      </endpoints>
      <connection-type>
        <persistent/>
      </connection-type>
    </netconf-client>
  </call-home>
</netconf-server>
<nacm xmlns="urn:ietf:params:xml:ns:yang:ietf-netconf-acm">
  <denied-operations>0</denied-operations>
  <denied-data-writes>0</denied-data-writes>
  <denied-notifications>0</denied-notifications>
</nacm>

**Comment by michalvasko** [comment]
Hi,
you could have been a bit more verbose with the steps.

1. You use *netopeer2-cli* to connect to a fresh installation of *netopeer2-server*.
2. Then you send `edit-config` with the example Call Home configuration.
3. You disconnect *netopeer2-cli* and reboot the device with *netopeer2-server* (not necessary, Call Home works from the moment it is configured).
4. Now you try to listen with ODL controller (so that *netopeer2-server* connects with Call Home) but it does not work? What exactly happens? What does *netopeer2-server* print?

Regards,
Michal

**Comment by qjwu888** [comment]
Hi Michal:
Updated netopeer2 (devel-server version 1.1.15), Listen with ODL controller (netopeer2-server connects with Call Home), now work fine.
But i found other issues:
1. Listen with ODL controller (netopeer2-server connects with Call Home), Netopeer2-server don't send keepalive packages,We need this function,how to enable?
call-home setting, keepalives enabled,but not work.
  <call-home>
    <netconf-client>
      <name>default-client</name>
      <endpoints>
        <endpoint>
          <name>default-ssh</name>
          <ssh>
            <tcp-client-parameters>
              <remote-address>192.168.10.123</remote-address>
              <remote-port>6666</remote-port>
              <keepalives>
                <idle-time>1</idle-time>
                <max-probes>10</max-probes>
                <probe-interval>5</probe-interval>
              </keepalives>
            </tcp-client-parameters>
            <ssh-server-parameters>
              <server-identity>
                <host-key>
                  <name>default-key</name>
                  <public-key>
                    <keystore-reference>genkey</keystore-reference>
                  </public-key>
                </host-key>
              </server-identity>
              <client-authentication>
                <supported-authentication-methods>
                  <publickey/>
                  <passsword/>
                  <other>interactive</other>
                </supported-authentication-methods>
                <users/>
              </client-authentication>
            </ssh-server-parameters>
          </ssh>
        </endpoint>
      </endpoints>
      <connection-type>
        <persistent/>
      </connection-type>
    </netconf-client>
  </call-home>

2.If i first install netopeer2(devel-server version 1.1.15) ,sysrepo-1.4.2,libyang,libnetconf2 in my device,and with the default setting,  wait the netopeer2-server  processes  run OK ,then exec netopeer-cli ,got the following error.
But if i first install,then reboot the device once,will always work fine.
Hope to get your help ,thanks!
=============the error log=============================
root@gpn-0E2404E487B2:~# netopeer2-cli
get_netconf_dir: Configuration directory "/root/.netopeer2-cli" did not exist, created.
load_config: No saved history.
load_config: No saved configuration.
> connect
The authenticity of the host 'localhost' cannot be established.
ssh-rsa key fingerprint is 26:d1:8c:14:cf:3c:a3:33:7e:92:70:af:36:a0:44:3a:c2:f0:1d:b2.
Are you sure you want to continue connecting (yes/no)? yes
Interactive SSH Authentication
Type your password:
Password: 
> get
cli_send_recv: Timeout for receiving a reply expired.

**Comment by michalvasko** [comment]
Hi,
1. You are right that *netopeer2-server* does not support the keep-alive defined in the [RFC](https://tools.ietf.org/html/rfc8071#page-8), more information about that can be found in https://github.com/CESNET/libnetconf2/issues/201. However, there is no keep-alive defined for the Call Home client (your ODL controller), so whatever it is doing is a proprietary functionality that our server does not support. The client is at fault here, it cannot require proprietary functionality from a NETCONF server.

2. I have just tried it and it worked just fine. Be careful with all the versions, you are using the latest *netopeer2* but not *sysrepo* (and *libyang* I assume) so I would suggest you update *sysrepo*, which will also require latest *libyang*.

Regards,
Michal

**Comment by qjwu888** [comment]
Hi Michal:

Sorry,I still don't fully understand. 
In earlier versions，Netopeer2-0.7-r2  and libnetconf2-0.12-r2 .
netopeer-server with callhome mode , send keepalives package to  ODL controller, it  work fine，why the  latest version don't support.

Libnetconf2-1.1.7   src  session.c  
Int nc_sock_enable_keepalive(int sock, struct nc_keepalives *ka)
{
    int opt;
    opt = ka->enabled;
    if (setsockopt(sock, SOL_SOCKET, SO_KEEPALIVE, &opt, sizeof opt) == -1) {
        ERR("Could not set SO_KEEPALIVE option (%s).", strerror(errno));
        return -1;
    }
    if (!ka->enabled) {
        return 0;
    }
#ifdef TCP_KEEPIDLE
    opt = ka->idle_time;
    if (setsockopt(sock, IPPROTO_TCP, TCP_KEEPIDLE, &opt, sizeof opt) == -1) {
        ERR("Setsockopt failed (%s).", strerror(errno));
        return -1;
    }
#endif
#ifdef TCP_KEEPCNT
    opt = ka->max_probes;
    if (setsockopt(sock, IPPROTO_TCP, TCP_KEEPCNT, &opt, sizeof opt) == -1) {
        ERR("Setsockopt failed (%s).", strerror(errno));
        return -1;
    }
#endif
#ifdef TCP_KEEPINTVL
    opt = ka->probe_interval;
    if (setsockopt(sock, IPPROTO_TCP, TCP_KEEPINTVL, &opt, sizeof opt) == -1) {
        ERR("Setsockopt failed (%s).", strerror(errno));
        return -1;
    }
#endif

    return 0;
}

**Comment by michalvasko** [comment]
Hi,
oh, you should have mentioned it worked fine in the legacy version. How exactly do you enable Call Home, what is the configuration you are using? Because unlike legacy versions, now is TCP keep-alive configurable so it must be enabled in the configuration.

Regards,
Michal

**Comment by qjwu888** [comment]
Callhome setting as attach file , is there any wrong?
[Callhome.txt](https://github.com/CESNET/Netopeer2/files/4305909/Callhome.txt)

**Comment by michalvasko** [comment]
Hi,
I have tried your configuration having changed `remote-address` to `127.0.0.1` so I connected on localhost. This is the output of `tcpdump`
```
# tcpdump -l -i lo
tcpdump: verbose output suppressed, use -v or -vv for full protocol decode
listening on lo, link-type EN10MB (Ethernet), capture size 262144 bytes
11:11:47.219203 IP localhost.ircu > localhost.48472: Flags [.], ack 3709184446, win 512, options [nop,nop,TS val 2333394948 ecr 2333389828], length 0
11:11:47.219231 IP localhost.48472 > localhost.ircu: Flags [.], ack 1, win 512, options [nop,nop,TS val 2333394948 ecr 2333385188], length 0
11:11:52.339204 IP localhost.ircu > localhost.48472: Flags [.], ack 1, win 512, options [nop,nop,TS val 2333400068 ecr 2333394948], length 0
11:11:52.339233 IP localhost.48472 > localhost.ircu: Flags [.], ack 1, win 512, options [nop,nop,TS val 2333400068 ecr 2333385188], length 0
11:11:57.463187 IP localhost.ircu > localhost.48472: Flags [.], ack 1, win 512, options [nop,nop,TS val 2333405191 ecr 2333400068], length 0
11:11:57.463215 IP localhost.48472 > localhost.ircu: Flags [.], ack 1, win 512, options [nop,nop,TS val 2333405192 ecr 2333385188], length 0
11:12:02.579202 IP localhost.ircu > localhost.48472: Flags [.], ack 1, win 512, options [nop,nop,TS val 2333410308 ecr 2333405192], length 0
11:12:02.579230 IP localhost.48472 > localhost.ircu: Flags [.], ack 1, win 512, options [nop,nop,TS val 2333410308 ecr 2333385188], length 0
11:12:07.699112 IP localhost.ircu > localhost.48472: Flags [.], ack 1, win 512, options [nop,nop,TS val 2333415427 ecr 2333410308], length 0
11:12:07.699140 IP localhost.48472 > localhost.ircu: Flags [.], ack 1, win 512, options [nop,nop,TS val 2333415427 ecr 2333385188], length 0
11:12:12.819210 IP localhost.ircu > localhost.48472: Flags [.], ack 1, win 512, options [nop,nop,TS val 2333420548 ecr 2333415427], length 0
11:12:12.819248 IP localhost.48472 > localhost.ircu: Flags [.], ack 1, win 512, options [nop,nop,TS val 2333420548 ecr 2333385188], length 0
```
Every 5 seconds a keep-alive packet was sent so it works correctly. The legacy version was sending precisely the same packets so if it no longer works, something in your ODL client must have changed, I see no other explanation. You can also check it with `tcpdump`, you should see similar output.

Regards,
Michal

**Comment by qjwu888** [comment]
Hi Michal:
I am using netopeer2 (devel-server version 1.1.15)  libnetconf2-1.1.7,
sysrepo-1.4.2 libyang-1.0.130
Is  it ok ?

**Comment by michalvasko** [comment]
Hi,
yes, that should be fine as far as this functionality is concerned.

Regards,
Michal

**Comment by qjwu888** [comment]
Hi Michal:
Could you tell me what version do you use ?
Still not work in my ubuntu(pc)  and my device(mtk board mips).

**Comment by michalvasko** [comment]
Hi,
what do you mean it does not work? You have established a Call Home session and `tcpdump` did not show any packets? As for me, I always use the latest `devel` version of all our projects and anyone who wants the latest bugfixes should also use it. `master` is a stable version, when things are working for you and you want to deploy your software or simply do not want to bother with possible API and behavior changes.

Regards,
Michal

**Comment by qjwu888** [comment]
Yes,I have established a Call Home session, and use ODL Controller setting ,work fine. But i can't find any keepalives package to ODL Controller from netopeer-server.
remote-address to 127.0.0.1
remote-port to 6666

![callhome](https://user-images.githubusercontent.com/50397234/76215967-bb6ff500-624a-11ea-8115-07ea4b3949d7.png)

**Comment by michalvasko** [comment]
Hi,
I am not able to help you more, I have no idea why it could not be working, you will have to look into it more. However, what is the output you posted? It is definitely not the output of any of our software, is it the ODL controller? Why does it say it is connecting when for Call Home it should actually be listening and the server connecting?

Regards,
Michal

**Comment by qjwu888** [comment]
Hi Michal,
Now work fine,thanks!
